{"min_row_valid":0.2,"rule":"cell = byte*0.1 - offset_int*0.01 (missing if byte == -128 or offset null); row_valid_share = valid cells / n_lon; row_mean = mean of valid cells or null when row_valid_share < min_row_valid; global_mean = cos(latitude) weighted mean over all valid cells (the row rule is not applied). Reference implementation: analytics/zonal.py","schema_version":"v1","sources":{"gistemp":{"baselines":{"1850-1900":{"available":false,"years":{}},"1951-1980":{"available":true,"years":{"1900":{"global_mean":-0.081526,"row_mean":[null,null,null,null,-0.233766,-0.583459,-0.648872,-0.797006,-0.741916,-0.662222,-0.531667,-0.422222,-0.346667,-0.313889,-0.289444,-0.203333,-0.103333,-0.059444,-0.063889,-0.108889,-0.127778,-0.167778,-0.191667,-0.181111,-0.210112,-0.245506,-0.215,-0.193333,-0.176111,-0.132611,-0.103778,-0.096667,-0.107614,-0.06358,-0.041317,-0.051829,-0.038235,-0.007692,0.018235,0.039766,0.087719,0.137647,0.190361,0.252695,0.285802,0.297778,0.295697,0.316463,0.294444,0.234146,0.216364,0.232727,0.204294,0.222892,0.215607,0.182486,0.136111,0.061,-0.0305,-0.135556,-0.238333,-0.321111,-0.385,-0.451667,-0.527222,-0.571111,-0.535556,-0.494444,-0.430222,-0.3975,-0.374444,-0.320556,-0.232955,-0.10415,-0.031212,0.051319,0.204762,0.169524,null,null,null,null,null,null,null,null,null,null,null,null],"row_valid_share":[0.0,0.0,0.0,0.0,0.427778,0.738889,0.738889,0.927778,0.927778,1.0,1.0,1.0,1.0,1.0,1.0,1.0,1.0,1.0,1.0,1.0,1.0,1.0,1.0,1.0,0.988889,0.988889,1.0,1.0,1.0,1.0,1.0,1.0,0.977778,0.977778,0.927778,0.911111,0.944444,0.938889,0.944444,0.95,0.95,0.944444,0.922222,0.927778,0.9,0.9,0.916667,0.911111,0.9,0.911111,0.916667,0.916667,0.905556,0.922222,0.961111,0.983333,1.0,1.0,1.0,1.0,1.0,1.0,1.0,1.0,1.0,1.0,1.0,1.0,1.0,1.0,1.0,1.0,0.977778,0.816667,0.733333,0.505556,0.233333,0.233333,0.0,0.0,0.0,0.0,0.0,0.0,0.0,0.0,0.0,0.0,0.0,0.0]},"1980":{"global_mean":0.252966,"row_mean":[-0.2,-0.2,-0.2,-0.2,-0.020556,0.025556,0.121667,0.262778,0.340556,0.387222,0.4,0.420556,0.401111,0.370556,0.321667,0.213333,0.098889,0.01,-0.047778,-0.086111,-0.111667,-0.101667,-0.074444,-0.050556,-0.021111,-0.006111,-0.020556,-0.033333,-0.034444,-0.002611,0.036778,0.099444,0.189222,0.272833,0.32,0.345,0.346667,0.333333,0.317778,0.328889,0.327778,0.320556,0.308889,0.310556,0.323333,0.315778,0.293278,0.270556,0.265556,0.252222,0.250556,0.266667,0.283889,0.296667,0.304444,0.322222,0.338333,0.360444,0.378389,0.389444,0.39,0.385,0.372222,0.347222,0.304444,0.290556,0.288333,0.285,0.300889,0.318056,0.356111,0.411111,0.448295,0.446139,0.430395,0.432549,0.418993,0.426053,0.319044,0.296525,0.29,0.258766,0.37604,0.419248,0.712333,0.786722,0.8,0.8,0.8,0.8],"row_valid_share":[1.0,1.0,1.0,1.0,1.0,1.0,1.0,1.0,1.0,1.0,1.0,1.0,1.0,1.0,1.0,1.0,1.0,1.0,1.0,1.0,1.0,1.0,1.0,1.0,1.0,1.0,1.0,1.0,1.0,1.0,1.0,1.0,1.0,1.0,1.0,1.0,1.0,1.0,1.0,1.0,1.0,1.0,1.0,1.0,1.0,1.0,1.0,1.0,1.0,1.0,1.0,1.0,1.0,1.0,1.0,1.0,1.0,1.0,1.0,1.0,1.0,1.0,1.0,1.0,1.0,1.0,1.0,1.0,1.0,1.0,1.0,1.0,0.977778,0.877778,0.844444,0.85,0.772222,0.844444,0.755556,0.783333,0.833333,0.855556,0.827778,0.738889,1.0,1.0,1.0,1.0,1.0,1.0]},"2025":{"global_mean":1.191631,"row_mean":[4.3,4.3,4.3,4.3,3.754444,3.607778,3.270556,2.86,2.646667,2.565,2.507778,2.463333,2.393333,2.341111,2.248889,2.118889,2.003333,1.928889,1.882778,1.83,1.773889,1.76,1.757778,1.763333,1.758333,1.73,1.673333,1.6,1.535,1.4535,1.371778,1.294444,1.233667,1.138944,1.06,0.987778,0.921111,0.837778,0.806111,0.795,0.773333,0.758333,0.756667,0.746111,0.767222,0.791333,0.812167,0.833889,0.851667,0.847222,0.834444,0.831111,0.852247,0.857778,0.872222,0.9,0.923333,0.957111,0.998944,1.021111,1.027778,1.022222,1.013889,0.980556,0.944444,0.909444,0.828333,0.765,0.687,0.623611,0.578889,0.526667,0.477841,0.478418,0.550789,0.754771,0.980863,1.148421,1.471985,1.585887,1.665333,1.655519,1.555906,1.442556,1.416778,1.331167,1.2,1.2,1.2,1.2],"row_valid_share":[1.0,1.0,1.0,1.0,1.0,1.0,1.0,1.0,1.0,1.0,1.0,1.0,1.0,1.0,1.0,1.0,1.0,1.0,1.0,1.0,1.0,1.0,1.0,1.0,1.0,1.0,1.0,1.0,1.0,1.0,1.0,1.0,1.0,1.0,1.0,1.0,1.0,1.0,1.0,1.0,1.0,1.0,1.0,1.0,1.0,1.0,1.0,1.0,1.0,1.0,1.0,1.0,0.988889,1.0,1.0,1.0,1.0,1.0,1.0,1.0,1.0,1.0,1.0,1.0,1.0,1.0,1.0,1.0,1.0,1.0,1.0,1.0,0.977778,0.877778,0.844444,0.85,0.772222,0.844444,0.755556,0.783333,0.833333,0.855556,0.827778,0.738889,1.0,1.0,1.0,1.0,1.0,1.0]}}},"1991-2020":{"available":true,"years":{"1900":{"global_mean":-0.68999,"row_mean":[null,null,null,null,-2.011948,-2.337218,-2.276917,-2.308024,-2.159281,-2.071389,-1.893833,-1.740222,-1.613889,-1.537056,-1.454944,-1.301778,-1.128944,-1.034333,-1.010611,-1.015111,-0.985222,-0.993222,-0.968222,-0.926,-0.903708,-0.902809,-0.849556,-0.803944,-0.778278,-0.721778,-0.677611,-0.659,-0.668239,-0.617955,-0.563353,-0.555915,-0.548588,-0.496864,-0.481706,-0.472515,-0.42462,-0.378588,-0.332349,-0.28497,-0.26963,-0.281358,-0.301758,-0.280854,-0.295123,-0.335976,-0.328485,-0.296,-0.306687,-0.284157,-0.288208,-0.324181,-0.377556,-0.448,-0.550889,-0.664222,-0.772667,-0.860889,-0.925111,-0.985278,-1.050444,-1.076444,-0.987667,-0.9015,-0.774,-0.681278,-0.614389,-0.530167,-0.41608,-0.276054,-0.207121,-0.187253,-0.27881,-0.515476,null,null,null,null,null,null,null,null,null,null,null,null],"row_valid_share":[0.0,0.0,0.0,0.0,0.427778,0.738889,0.738889,0.927778,0.927778,1.0,1.0,1.0,1.0,1.0,1.0,1.0,1.0,1.0,1.0,1.0,1.0,1.0,1.0,1.0,0.988889,0.988889,1.0,1.0,1.0,1.0,1.0,1.0,0.977778,0.977778,0.927778,0.911111,0.944444,0.938889,0.944444,0.95,0.95,0.944444,0.922222,0.927778,0.9,0.9,0.916667,0.911111,0.9,0.911111,0.916667,0.916667,0.905556,0.922222,0.961111,0.983333,1.0,1.0,1.0,1.0,1.0,1.0,1.0,1.0,1.0,1.0,1.0,1.0,1.0,1.0,1.0,1.0,0.977778,0.816667,0.733333,0.505556,0.233333,0.233333,0.0,0.0,0.0,0.0,0.0,0.0,0.0,0.0,0.0,0.0,0.0,0.0]},"1980":{"global_mean":-0.358189,"row_mean":[-2.09,-2.09,-2.09,-2.09,-1.853167,-1.764444,-1.569222,-1.269889,-1.100722,-1.021944,-0.962167,-0.897444,-0.866111,-0.852611,-0.843833,-0.885111,-0.926722,-0.964889,-0.9945,-0.992333,-0.969111,-0.927111,-0.851,-0.795444,-0.72,-0.668278,-0.655111,-0.643944,-0.636611,-0.591778,-0.537056,-0.462889,-0.375556,-0.285833,-0.226056,-0.189556,-0.179722,-0.174722,-0.197722,-0.195278,-0.195556,-0.206944,-0.229833,-0.240278,-0.248889,-0.277167,-0.314611,-0.338167,-0.3385,-0.335222,-0.313778,-0.285667,-0.259722,-0.238333,-0.219556,-0.194722,-0.175333,-0.148556,-0.142,-0.139222,-0.144333,-0.154778,-0.167889,-0.186389,-0.218778,-0.214778,-0.163778,-0.122056,-0.042889,0.034278,0.116167,0.2015,0.26517,0.270253,0.270838,0.216098,0.092,0.080641,-0.061214,-0.130897,-0.185974,-0.236013,-0.102745,-0.049346,0.249389,0.379389,0.6,0.6,0.6,0.6],"row_valid_share":[1.0,1.0,1.0,1.0,1.0,1.0,1.0,1.0,1.0,1.0,1.0,1.0,1.0,1.0,1.0,1.0,1.0,1.0,1.0,1.0,1.0,1.0,1.0,1.0,1.0,1.0,1.0,1.0,1.0,1.0,1.0,1.0,1.0,1.0,1.0,1.0,1.0,1.0,1.0,1.0,1.0,1.0,1.0,1.0,1.0,1.0,1.0,1.0,1.0,1.0,1.0,1.0,1.0,1.0,1.0,1.0,1.0,1.0,1.0,1.0,1.0,1.0,1.0,1.0,1.0,1.0,1.0,1.0,1.0,1.0,1.0,1.0,0.977778,0.877778,0.927778,0.911111,0.833333,0.866667,0.777778,0.805556,0.855556,0.877778,0.85,0.85,1.0,1.0,1.0,1.0,1.0,1.0]},"2025":{"global_mean":0.581703,"row_mean":[2.41,2.41,2.41,2.41,1.921833,1.817778,1.579667,1.327333,1.205389,1.155833,1.145611,1.145333,1.126111,1.117944,1.083389,1.020444,0.977722,0.954,0.936056,0.923778,0.916444,0.934556,0.981222,1.018444,1.059444,1.067833,1.038778,0.989389,0.932833,0.864333,0.797944,0.732111,0.668889,0.580278,0.513944,0.453222,0.394722,0.329722,0.290611,0.270833,0.25,0.230833,0.217944,0.195278,0.195,0.198389,0.204278,0.225167,0.247611,0.259778,0.270111,0.278778,0.309888,0.322778,0.348222,0.383056,0.409667,0.448111,0.478556,0.492444,0.493444,0.482444,0.473778,0.446944,0.421222,0.404111,0.376222,0.357944,0.343222,0.339833,0.338944,0.317056,0.294716,0.302532,0.419341,0.539268,0.652,0.807564,1.090214,1.156,1.186456,1.212056,1.152611,1.044056,0.953833,0.923833,1.0,1.0,1.0,1.0],"row_valid_share":[1.0,1.0,1.0,1.0,1.0,1.0,1.0,1.0,1.0,1.0,1.0,1.0,1.0,1.0,1.0,1.0,1.0,1.0,1.0,1.0,1.0,1.0,1.0,1.0,1.0,1.0,1.0,1.0,1.0,1.0,1.0,1.0,1.0,1.0,1.0,1.0,1.0,1.0,1.0,1.0,1.0,1.0,1.0,1.0,1.0,1.0,1.0,1.0,1.0,1.0,1.0,1.0,0.988889,1.0,1.0,1.0,1.0,1.0,1.0,1.0,1.0,1.0,1.0,1.0,1.0,1.0,1.0,1.0,1.0,1.0,1.0,1.0,0.977778,0.877778,0.927778,0.911111,0.833333,0.866667,0.777778,0.805556,0.877778,1.0,1.0,1.0,1.0,1.0,1.0,1.0,1.0,1.0]}}}},"grid_id":"gistemp_2deg","lat_centers":[89.0,87.0,85.0,83.0,81.0,79.0,77.0,75.0,73.0,71.0,69.0,67.0,65.0,63.0,61.0,59.0,57.0,55.0,53.0,51.0,49.0,47.0,45.0,43.0,41.0,39.0,37.0,35.0,33.0,31.0,29.0,27.0,25.0,23.0,21.0,19.0,17.0,15.0,13.0,11.0,9.0,7.0,5.0,3.0,1.0,-1.0,-3.0,-5.0,-7.0,-9.0,-11.0,-13.0,-15.0,-17.0,-19.0,-21.0,-23.0,-25.0,-27.0,-29.0,-31.0,-33.0,-35.0,-37.0,-39.0,-41.0,-43.0,-45.0,-47.0,-49.0,-51.0,-53.0,-55.0,-57.0,-59.0,-61.0,-63.0,-65.0,-67.0,-69.0,-71.0,-73.0,-75.0,-77.0,-79.0,-81.0,-83.0,-85.0,-87.0,-89.0],"n_lat":90},"hadcrut5":{"baselines":{"1850-1900":{"available":true,"years":{"1900":{"global_mean":0.087976,"row_mean":[null,null,0.023478,0.395714,0.383846,0.115854,0.18,0.180385,0.2875,0.304255,0.216136,0.138293,0.046897,0.116538,0.230769,0.244737,0.1725,null,0.07,0.099412,0.032105,0.023913,0.145278,0.165532,0.002,-0.197347,-0.319184,-0.287895,-0.0755,null,null,null,null,null,null,null],"row_valid_share":[0.0,0.138889,0.319444,0.291667,0.361111,0.569444,0.708333,0.722222,0.777778,0.652778,0.611111,0.569444,0.402778,0.361111,0.361111,0.263889,0.222222,0.166667,0.208333,0.236111,0.263889,0.319444,0.5,0.652778,0.694444,0.680556,0.680556,0.527778,0.277778,0.138889,0.097222,0.0,0.0,0.0,0.0,0.0]},"1980":{"global_mean":0.520223,"row_mean":[null,null,0.927826,1.205238,1.03,0.720732,0.497647,0.263077,0.239286,0.23617,0.293409,0.328537,0.491724,0.578077,0.634615,0.55,0.46,null,0.403333,0.393529,0.364,0.4125,0.516667,0.720851,0.792,0.759796,0.668571,0.648947,0.6345,null,null,null,null,null,null,null],"row_valid_share":[0.0,0.138889,0.319444,0.291667,0.361111,0.569444,0.708333,0.722222,0.777778,0.652778,0.611111,0.569444,0.402778,0.361111,0.361111,0.263889,0.222222,0.166667,0.20833